{
  "$schema": "https://json-schema.org/draft/2020-12/schema",
  "$id": "https://aoa.local/schemas/pattern_lineage_integrity_verdict_v1.json",
  "title": "pattern_lineage_integrity_verdict_v1",
  "type": "object",
  "required": [
    "schema_version",
    "kind",
    "id",
    "status",
    "summary",
    "evidence_refs",
    "payload",
    "owner_repo"
  ],
  "properties": {
    "schema_version": {
      "type": "string",
      "const": "1.0"
    },
    "kind": {
      "type": "string",
      "const": "pattern_lineage_integrity_verdict"
    },
    "id": {
      "type": "string",
      "minLength": 3
    },
    "status": {
      "type": "string",
      "enum": [
        "draft",
        "captured",
        "candidate",
        "review",
        "approved",
        "blocked",
        "rejected",
        "promoted",
        "active",
        "retired",
        "scheduled",
        "passed",
        "failed"
      ]
    },
    "summary": {
      "type": "string",
      "minLength": 1
    },
    "owner_repo": {
      "type": "string"
    },
    "evidence_refs": {
      "type": "array",
      "items": {
        "type": "string"
      },
      "minItems": 1
    },
    "payload": {
      "type": "object",
      "required": [
        "lineage_intact",
        "merge_allowed",
        "split_allowed"
      ],
      "additionalProperties": false,
      "properties": {
        "lineage_intact": {
          "type": "boolean"
        },
        "merge_allowed": {
          "type": "boolean"
        },
        "split_allowed": {
          "type": "boolean"
        }
      }
    }
  },
  "additionalProperties": false
}
